{
  "schema_version": "topic-0.1",
  "id": "flash-attention-4-softmax",
  "title": "FlashAttention-4 SM100 softmax warpgroups",
  "coverage": { "glob": "graphs/flash-attention-4-softmax/*.svg" },
  "sources": [
    {
      "id": "flash-attention",
      "kind": "implementation",
      "repository": "https://github.com/Dao-AILab/flash-attention",
      "commit": "2402cb0",
      "paths": ["flash_attn/cute/flash_fwd_sm100.py"],
      "evidence": "The two softmax warpgroup branches, softmax_loop, softmax_step, TMEM loads/stores, split P publication, and correction barriers were inspected directly."
    }
  ],
  "authoring": {
    "goal": "Reconstruct what one SM100 softmax warpgroup does and why correction and PV can overlap it.",
    "audience": "GPU kernel engineers familiar with online softmax and TMEM.",
    "reading_order": ["two Q-stage groups", "score-to-P operation order", "early correction handoff", "split P readiness", "SMEM/TMEM ownership"],
    "required_content": ["prologue, mainloop, and epilogue phases", "warps 0-3 and 4-7", "TMEM score load", "mask and online max/sum", "96+32 or equivalent split P publication", "separate correction and MMA consumers", "aligned TMEM score, P, and O lifetimes"],
    "excluded_content": ["unrelated load-warp details", "cycle timing"]
  },
  "qa": {
    "profile": "direct-role-memory",
    "min_width": 2400,
    "required_classes": [
      { "class": "lane-title", "minimum": 5 },
      { "class": "outline", "minimum": 20 },
      { "class": "early", "minimum": 5 },
      { "class": "phase-band", "minimum": 3 },
      { "class": "source-specific", "minimum": 1 },
      { "class": "resource-lifetime", "minimum": 2 },
      { "class": "life-box", "minimum": 2 }
    ],
    "source_text_classes": ["code"]
  }
}
